,user.userId,commentId,user.nickname,content,timeStr,likedCount,ipLocation.location,time
422,3278959295,5707141215,好想抱抱你小乖,你每次回我消息很慢 于是我也故意回的很慢 我以为我们扯平了 没想到你根本不在乎,2022-07-19,0,,1658219510632
423,3278959295,5707141195,好想抱抱你小乖,有时候很羡慕会说话的人 可惜我总是因为一件事就不想和对方说话,2022-07-19,0,,1658219503697
424,3278959295,5707141160,好想抱抱你小乖,我承认  我是个虚伪的人  吃醋了就装作不在乎  生气了就装作无所谓  但我还是希望你懂我,2022-07-19,0,,1658219491669
425,1594584438,5707128361,梓熙180910,房明博我想你了,2022-07-19,0,,1658218067307
426,2082693146,5707125393,每天都好困x-,每次你问我生没生气我都说没有 那是因为我嘴硬 骗你的啦 其实我每次气的都胃疼总是掉眼泪。,2022-07-19,2,,1658217711090
427,5081935591,5707121941,爱他ch,我喜欢一个人但是我不敢表白我怕他不同意  我真的很喜欢他,2022-07-19,0,,1658217189813
428,3229122550,5707120425,h_橘子海,唐璟轩.我要是图你点什么就好了 可惜我不是那种人 我只希望你带着真诚陪在我身边就好了.,2022-07-19,1,,1658217088507
429,3229122550,5707120313,h_橘子海,唐璟轩.什么时候才能轮到我们复合呢.,2022-07-19,1,,1658217048352
430,3285732810,5707114775,嫣梧婳-Y,忘与记同存越爱就越害人.,2022-07-19,0,,1658216282258
431,3285732810,5707112726,嫣梧婳-Y,我并不希望我的爱是凌晨流不完的眼泪.,2022-07-19,0,,1658216263209
432,3332561901,5707114080,爱他就为他开VIP,陈飞宇，好爱你,2022-07-19,3,,1658216204752
433,3332561901,5707113018,爱他就为他开VIP,陈飞宇，3个月27天了，小笨蛋有没有想我，我好想见你啊，yiqing好烦哦，阻挡了我们两个见面,2022-07-19,1,,1658216148796
434,1646217957,5707103297,帐号已注销,什么时候才可以走出这该死的循环,2022-07-19,13,,1658215087935
435,3337719184,5707102577,TiAmo-_循环键,以为有多坚固呢 风一吹就散了,2022-07-19,0,,1658215022493
436,2107856392,5707096166,情绪下小雨_iz,你跟她也会听这首歌 好羡慕她啊能天天见到你 我也好像见你一面 说一些一直想对你说的话 好想你,2022-07-19,0,,1658214191272
437,1751486078,5707096160,7noh,宝宝，开心点。,2022-07-19,5,,1658214189430
438,1751486078,5707095137,7noh,《禁止emo》,2022-07-19,3,,1658214177342
439,1751486078,5707094322,7noh,想什么呢，好好学习。,2022-07-19,3,,1658214103737
440,7951960894,5707093535,帐号已注销,我和他是同班同学，一年半的同桌，和他关系很好，他总是会听我的话，至于对他有了好感，但同学和他兄弟说我们是不是在一起了，我只会笑着说没有，我们只是好朋友啦，期末复习的时候，不知道他怎么了不找我了，最后我们俩逐渐就不联系不一起玩了。这是我和他，最后就算了吧，毕竟我也不漂亮，祝你开心。,2022-07-19,2,,1658213947854
441,1751486078,5707093110,7noh,希望大家都不要被困在爱里。,2022-07-19,2,,1658213789792
442,3249228777,5707086215,帐号已注销,我疯了似的找你联系方式。,2022-07-19,1,,1658213039452
443,3249228777,5707087022,帐号已注销,昨天听到你对别人说你坚持不下去了。,2022-07-19,1,,1658213024435
444,3249228777,5707085328,帐号已注销,不要天天不吃饭给自己落下胃病。,2022-07-19,3,,1658213004590
445,3249228777,5707086908,帐号已注销,别再像这辈子一样那么倔 那么贪玩,2022-07-19,1,,1658212974769
446,3249228777,5707085188,帐号已注销,林以琛 下辈子要好好吃饭照顾好自己。,2022-07-19,2,,1658212952530
447,3249228777,5707085093,帐号已注销,林以琛 这辈子不行那我们下辈子见吧。,2022-07-19,3,,1658212913121
448,4995214173,5707081650,睡个好觉吧了,亲爱的泽 我又来了 照顾好自己,2022-07-19,0,,1658212481844
449,2017799748,5707070104,冉要拯救世界啦,子韩先生，我是川，感谢你这几天的陪伴，我很喜欢你，但是啊,2022-07-19,1,,1658210990837
450,1375245351,5707068672,末日之后再相见,随便吧，我没心,2022-07-19,1,,1658210947465
451,1461135625,5707067610,JUAN-2331,爱，本就是让双方都痛苦的,2022-07-19,1,,1658210801270
452,6400227161,5707068052,讨厌死这个B世界,如果说是深爱 为何说不出口,2022-07-19,0,,1658210704806
453,3682507225,5707063025,追求_他,小乖 你欠了我好多个晚安,2022-07-19,3,,1658209962917
454,6406746010,5707062761,8ikno,J 这次我们该分头走了 你去寻找你的幸福 我去寻找我的幸福,2022-07-19,1,,1658209854109
455,5064450337,5707055689,1-二次海,交出真心时又哪知对方是无心人.,2022-07-19,2,,1658209442861
456,1539772039,5707052052,-悲伤特猫头h-,好想知道你到底喜不喜欢我 别暧昧了 我跟喜欢的人才打直球 我不开心了 就想你来哄哄我 摸摸我的头说“没事的 有我在 你不用坚强”,2022-07-19,1,,1658208812506
457,6300415652,5707047645,早睡_ls,早点睡宝宝们 好好爱自己才是王道,2022-07-19,1,,1658208614043
458,1408069001,5707041310,本该冰冷无趣,露，我不敢登抖音和ks，微信我也是尽量不去看你，因为我怕看到让我难过的东西，我不敢面对你，我会难过的，我会哭的，露，你不爱我，当然会觉得我的爱束缚着你，露，这段故事最后退场的人是我，我不甘心，我不舍得，可你把我换了，换成跟另一个人有关的，露，我好难过，我不能接受,2022-07-19,1,,1658207859564
459,1408069001,5707040748,本该冰冷无趣,露，那天我空间发了个女生，你说我释怀的快，哈哈，露，也许你是真不懂，我是装给你看的，我想看看你的反应，露，是我不好，我应该按捺我的情绪的，分手后不管我做什么，你都烦我，我还是会忍你生气，露，我们的回忆太美好，好像一场梦，我不想醒来,2022-07-19,68,,1658207535490
460,1408069001,5707040085,本该冰冷无趣,露，你喜欢江添，哈哈，我没有看过这本书，我不知道江添是怎么样的一个人，应该很帅很深情很好吧，我不清楚，不过，我应该比不上，我不帅，性子你也不喜欢，再爱有什么用，露，你还太小，也许我真的无法做被你托付一生的人，遇到更好的，你还是会忘了我的，露,2022-07-19,2,,1658207417747
461,5105771177,5707036088,叽里咕噜咕噜鑫,16岁 独立完成七道数学题 没靠答案 没靠老师 没靠家长 更没靠作业帮 家银们 独立女人就是爽！[多多比耶],2022-07-19,45,,1658207002676
462,3577174695,5707034694,画不缘的圈,我最讨厌冷暴力,2022-07-19,1,,1658206944067
463,5159684600,5707033375,雨天记情书,听歌嘛.,2022-07-19,0,,1658206757633
464,1606234717,5707032219,风声随雾散去,宝宝涵，可不可以不拿分手开玩笑了,2022-07-19,0,,1658206626057
465,5135889770,5707030726,MK-A1119,爱我就要为我放弃地球上41亿的女孩子咯。,2022-07-19,0,,1658206538610
466,1408069001,5707026490,本该冰冷无趣,露，我已经能忍住不去找你啦，可我还是忍不住去偷看你，是我贱，明明知道，去偷看你，我会难过的，可我还是忍不住，可我看到你有对象了，你会很幸福的，我就忍不住哭，可你从没心疼过我的泪，没在意我的情，露，我没想到过有这一天，露，我没想到你对我如此狠心，我以为我们就算分，也会复合，能熬过去,2022-07-19,0,,1658206043873
467,3301953744,5707026072,_L-N,旭，回头好难，我想一直向你走，可是旭，我没办法走了.,2022-07-19,0,,1658205905461
468,3301953744,5707024655,_L-N,旭，释怀好难啊，我想见你.,2022-07-19,0,,1658205819197
469,3301953744,5707025746,_L-N,旭，为什么有结果的不能是我们呢.,2022-07-19,0,,1658205791935
470,3301953744,5707023708,_L-N,张佳旭，我下辈子还想遇见你，可是如果我们没有缘分怎么办.,2022-07-19,0,,1658205775905
471,3301953744,5707025263,_L-N,张佳旭，我喜欢了你那么久，那天我加你，我问你，我们为什么会分手，你说不想耽误我，旭啊，是我太过幼稚了吧.,2022-07-19,0,,1658205749728
472,1408069001,5707025196,本该冰冷无趣,露，你做的王者视频，我们游戏的截图，你的照片，你的声音，这些都会让我回忆，让我难过，你已经不在我身边了，露，我想得到你的真心，我想你的心是属于我的，为什么我做不到，为什么呢，如果我不粘人，占有欲不强就好了，如果我能忍住性子，去陪你忘记你的执念，不去提他，也许我们真的可以走很远很远,2022-07-19,0,,1658205727295
473,3301953744,5707023508,_L-N,张佳旭，回头看看我好不好，我哭不动了.,2022-07-19,2,,1658205703008
474,1408069001,5707025131,本该冰冷无趣,我当然知道太主动会显得很掉价 但是我宁愿丢掉面子也不要放弃你,2022-07-19,0,,1658205701546
475,3357424423,5707023485,doumoli,本来就应该早点结束的，谢谢你比我做的绝，不然我肯定还陷在你那里,2022-07-19,1,,1658205694555
476,3301953744,5707023325,_L-N,张佳旭，我好想你，你为什么不能回头看看我呢.,2022-07-19,1,,1658205638843
477,3301953744,5707024064,_L-N,旭，我们已经分开一个月了，真的没可能了吗.,2022-07-19,1,,1658205617687
478,3301953744,5707023976,_L-N,张佳旭，我好想你.,2022-07-19,1,,1658205588155
479,1467545583,5707021205,Fissh_i,2022还在听这首歌，爱了，单曲循环无数遍,2022-07-19,2,,1658205318495
480,1467545583,5707021049,Fissh_i,可惜没如果。,2022-07-19,1,,1658205261023
481,5008950050,5707015526,嘉要被爱,胖胖，如果我没有做那些事情，我们会分开吗,2022-07-19,1,,1658204738971
482,5142989417,5707013425,爱是逆风局u,我可以对全世界的人大喊我爱你 唯独不能在你耳边低语我的深情 换句话说全世界都知道我爱你 唯独你不知道。,2022-07-19,1,,1658204421151
483,444212120,5707008596,早就厌烦,想你,2022-07-19,6,,1658204032830
484,3229122550,5707007653,h_橘子海,不想再偷偷看你的主页了.我们和好好吗.我光明正大的看.开着情空用着情头.下次你不要偷偷看我空间了好不好.不要解除情空了.我们长长久久的一起手牵手走下去.还想和你一起走路回家打打闹闹.太怀念了.那时候我们天天见.,2022-07-19,2,,1658203790455
485,1678994690,5707007485,褒姒_qx,没谈恋爱 但总是感慨 心情沉重,2022-07-19,0,,1658203724996
486,3229122550,5707005377,h_橘子海,唐璟轩复合好吗.好想你.复合吧.我拿七分情换你三分诚.其实我一直在你身后只差你回头.不信你回头.一直在等你.我觉得我们不应该因为那点小事就分开了.不管你愿不愿意相信我.我还是希望你能回头.听我说.而不是听说我.,2022-07-19,1,,1658203585711
487,5159684600,5707005961,雨天记情书,如果以后还有你 我一定会很幸福@寄給海的情书,2022-07-19,1,,1658203440658
488,449959136,5707004280,星露_xdl,明明没有失恋却感觉已经失恋了一百回,2022-07-19,1,,1658203283759
489,3229122550,5707003938,h_橘子海,唐璟轩该拿什么释怀呢.今天是我们分开的25天.她们都说释怀的尽头是恨.可是怎么恨呢.恨不起来你是我青春里唯一的一次勇敢.你身上有我轰轰烈烈爱过的痕迹我恨不起来.太想你了.还能和好吗.我们重新开始.这次就我们两个人.不要在掺和他人进来了好吗.唐璟轩.能和好吗还能的话我们就一起去散散步吧,2022-07-19,1,,1658203172487
490,4026512438,5706991430,笨-蛋_2,后来我没有拒绝吹来的风 也没有遇见特别喜欢的人 ,2022-07-19,1,,1658201761534
491,4026512438,5706991269,笨-蛋_2,生活是自己的 请尽情打扮 尽情可爱 眼里装着太阳 笑里全是坦荡,2022-07-19,0,,1658201704796
492,4026512438,5706991938,笨-蛋_2,让我赢一次吧 这次我也想站在光里听你说我爱你.,2022-07-19,0,,1658201688621
493,4026512438,5706991185,笨-蛋_2,再好的缘分也经不起敷衍 再好的感情也需要珍惜 这个世界上没有绝对的傻瓜 只有愿意为你装傻和原谅你的人.,2022-07-19,0,,1658201675306
494,4026512438,5706991796,笨-蛋_2,走错了路要记得回头 趁天还没黑 趁你还记得归途.,2022-07-19,0,,1658201641851
495,3872424727,5706976256,转眼又两年,动态,2022-07-19,0,,1658200178156
496,1782955877,5706976085,一模加油,执念太深，就是好想让你喜欢上我啊,2022-07-19,0,,1658200118369
497,7945738612,5706969770,芦荟_d0dz,找个人一起听啊[多多瞌睡],2022-07-19,0,,1658199242760
498,7945738612,5706968968,芦荟_d0dz,让你拿什么爱我呢 我有肉肉的脸蛋 不高的身高 没有90斤的身材 没有好看的外貌 你拿什么爱我呢,2022-07-19,0,,1658199161247
499,2034640375,5706961250,别离开我想你,那真诚换来的又是什么,2022-07-19,0,,1658198292658
0,2034640375,5706962021,别离开我想你,我不懂什么是爱，我只想对你好,2022-07-19,1,,1658198274874
1,2034640375,5706961183,别离开我想你,你说我会遇见更好的人 其实是你想遇见更好的,2022-07-19,2,,1658198258223
2,1868854858,5706961923,Definition_vv,真的绝,2022-07-19,0,,1658198241857
3,2034640375,5706961897,别离开我想你,那你呢，释怀了吗,2022-07-19,0,,1658198231691
4,517001907,5706958989,金毛小狗-,如果是真的爱我那为何说不出口,2022-07-19,1,,1658197868103
5,517001907,5706957360,金毛小狗-,天天凌晨五点睡觉什么感觉,2022-07-19,1,,1658197754840
6,6348820673,5706957326,讨厌坏情绪波动TTKX,天天开心。。,2022-07-19,1,,1658197738766
7,6348820673,5706955597,讨厌坏情绪波动TTKX,凌晨两点钟到心事都是你 那你呢小少爷也会想起我吗,2022-07-19,2,,1658197699338
8,6348820673,5706957129,讨厌坏情绪波动TTKX,没有回不了的信息 只有想不想回.,2022-07-19,4,,1658197656926
9,5116763182,5706954381,Hellow-77_,好听的话别记太久 人总会变,2022-07-19,1,,1658197520158
10,5116763182,5706956746,Hellow-77_,数不清这是第几次我也不知道,2022-07-19,1,,1658197494182
11,5199698824,5706954785,朝思暮年年,那些对我的承诺 只是说说而已吗,2022-07-19,2,,1658197372169
12,5163200288,5706953208,什么小心点啊,难过的是你连让我等你的话都是假的,2022-07-19,1,,1658197274635
13,4920907857,5706952854,永远胤,走进过心里的人怎么可能轻易忘记,2022-07-19,2,,1658197120097
14,5090498396,5706947375,厌欺骗的静,有一个故事五年后讲给你们听,2022-07-19,0,,1658196532134
15,5090498396,5706945462,厌欺骗的静,"我爱你 我.爱.你 我…爱…你…

你看懂了嘛？ 先是爱或者喜欢到最后慢慢的就不喜欢了…",2022-07-19,0,,1658196453688
16,5159684600,5706938735,雨天记情书,一厢情愿罢了。,2022-07-19,5,,1658195307323
17,4892935020,5706936863,临倦o,默 关于我们之间的故事 真的结束了 就把那段藏起来吧 即使知道你是什么样的人 即使知道你很浪 在我这里永远都是觉得你好 你真的很好 只是不属于我 不会这样去处理情感的事情 那这次我们就真的散了 不会再记起你了 我很念旧 但我只念那段时光 不恋人 默 我们下次在见,2022-07-19,2,,1658195088497
18,3312266193,5706914413,旺仔晚在,小屁孩 记住了 下次恋爱一定要从一束花和告白开始.,2022-07-19,9,,1658191773463
19,3725704222,5706910417,祈雪寄予卿,他好讨厌，让我掉了好多眼泪，想放弃他，但是好难受,2022-07-19,21,,1658190955519
20,6348820673,5706906619,讨厌坏情绪波动TTKX,小少爷 放下你手中的剑 抱抱我吧  如果说是真的爱我 那为何都说出口,2022-07-19,2,,1658190421436
21,3380494343,5706899541,A呆呆悦,你当然不会心疼我啦 你身边的人那么多,2022-07-19,0,,1658188948119
22,3404050596,5706895137,单恋佳崽,彭飞云你确实赢了 你会占据我整个青春的回忆 我会在无数个深夜想起你 。,2022-07-19,2,,1658187466519
23,3404050596,5706895104,单恋佳崽,人都会腻的 都会有烦的时候 只不过有人选择陪伴 有人选择一拍两散  所以彭飞云 你选择了后者对吗,2022-07-19,9,,1658187437439
24,3404050596,5706895070,单恋佳崽,相爱很难 不是人人都有机会 所以我们都更应该珍惜彼此不是吗彭飞云。,2022-07-19,7,,1658187408161
25,3404050596,5706894222,单恋佳崽,彭飞云 你心真的好狠 我好恨你,2022-07-19,6,,1658187383276
26,3404050596,5706893502,单恋佳崽,彭飞云 我怎么也不会想到  冷暴力就是我们最终的散局,2022-07-19,5,,1658187349525
27,3404050596,5706894161,单恋佳崽,为什么我那么爱你 到头来换来你一句廉价 啊彭飞云 你有没有心。,2022-07-19,2,,1658187318554
28,3404050596,5706894136,单恋佳崽,再找你的话我会显得很卑微吗 你会觉得我廉价吗彭飞云,2022-07-19,1,,1658187293089
29,3404050596,5706894924,单恋佳崽,如果不分开的话我们在一起多久了彭飞云,2022-07-19,2,,1658187273349
30,3404050596,5706894903,单恋佳崽,困住我的不是你 是我们的曾经啊彭飞云,2022-07-19,3,,1658187249104
31,3404050596,5706894068,单恋佳崽,彭飞云 那天我一直盯着你看 还是想不通 为什么眼前的这个人跟以前不一样了呢,2022-07-19,4,,1658187233084
32,3958381658,5706893337,珊崽wikk,向纭锋   你说你爱我  但是我现在相信不了你了  祝你和那个女孩子幸福   不祝你们只祝你,2022-07-19,0,,1658187193185
33,1509184267,5706879618,追随我直到世界的尽头,就让我放下所有回忆,2022-07-19,0,,1658180116883
34,1339991180,5706879526,小甜心蕴宝,汤政杰 我没有不真诚 不真诚都是留给死人的 我对你很认真了 我教你爱 那你就要好好爱下一个 别让女孩子失望了 你谈恋爱的时候我没有打扰过你 我有想过祝你幸福 但是我觉得没有我你不该幸福,2022-07-19,1,,1658179848496
35,1339991180,5706880772,小甜心蕴宝,汤政杰 马上天亮了 那天喝醉 我说好想你 你说你也有事情要做 不可能24个小时看着我 现在24小时过去了 你也不能一分钟都不能抽给我吧 求你 从我的记忆里滚出去吧,2022-07-19,1,,1658179666632
36,1740732356,5706879286,帅字跟了我一辈子,你说的在一起好久好久 还算话吗,2022-07-19,1,,1658179310446
37,6366211884,5706879183,漠清oe,"分开的第79天
萱，我很想你
萱，我很爱你
萱，你还爱我吗
萱，你真的还爱我吗
萱，你为什么不能说一句爱我
萱，是不是我让你不高兴了
萱，我快坚持不住了
萱，我爱你",2022-07-19,1,,1658179048006
38,6366211884,5706878956,漠清oe,萱，如果你爱我，为什么你从来不说爱我，所有人都在说你爱我，唯独我自己，一点都感觉不到，我真的很爱你，但如果你不爱我，就说出来，让我走好吗,2022-07-19,1,,1658178574142
39,1803836749,5706878873,雾雾uo,分手后的第一次见面 喝的醉醺醺 自以为很浪漫对他说 可以牵手吗 我们很久没有牵手了 他拒绝了但还是给我牵 那时候窃喜 有机会 我一定有机会 第二天晚上在他下班之前买了奶茶赶到他上班的附近 跟他说我在等他 结果他加班 等了两个小时 期间肚子隐隐作痛很疼 在刺疼 疼的我呼不过气 终于等到他下班了 他,2022-07-19,1,,1658178406832
40,4976307194,5706877240,我想我是破碎的_,早睡什么时候可以让我体验一次呢,2022-07-19,0,,1658177550121
41,4976307194,5706876423,我想我是破碎的_,想对喜欢过我的人说  谢谢  但我的心从来没有放弃过一个人  对不起 你们值得以后更好的人,2022-07-19,0,,1658177521832
42,4976307194,5706876380,我想我是破碎的_,如果可以  我想回到1年前的那天晚上 不去给你发那条信息,2022-07-19,2,,1658177439597
43,4976307194,5706875693,我想我是破碎的_,被爱的人不晚睡 现在是凌晨四点四十九.,2022-07-19,2,,1658177356300
44,1950160076,5706875225,_徐岸,妮 要是我们各退一步是不是就不一样了,2022-07-19,0,,1658176510828
45,1950160076,5706875193,_徐岸,怡 你说我们曾经那么好的关系 三年啊 怎么会在最后那一个月崩掉呢 挺遗憾的 但是我不想再认识你了,2022-07-19,0,,1658176457370
46,1950160076,5706875743,_徐岸,瀚 要是没同意你就好了,2022-07-19,0,,1658176373965
47,1950160076,5706874928,_徐岸,章 我总是会想 凭什么你无缝衔接 凭什么分手也不说全原因 为什么还喜欢别人还要来跟我在一起 为什么要一心二用 我讨厌你 即使说服过自己千百遍 可我控制不住地在恨你 我知道你跟我在一起挺不好的 我性格是问题 让你那段时间挺累的 也对不起总说你的坏话 可也许永远不会原谅你的吧 我也不清楚 但愿,2022-07-19,0,,1658176335459
48,1946610805,5706872660,ZR泽_7,锦 不知不觉现在已经四点了 我好想你 我好累 不想再哭了 我已经等了很久 你为什么就不肯回头看看我呢哪怕就一眼 没关系我可以慢慢等 你会回来接我的对吗,2022-07-19,0,,1658175659529
49,1950160076,5706873884,_徐岸,嘉 我不讨厌你 我永远都在嘴硬 总在逼你离开 你爱要面子 但你低过三次头 所以我总庆幸你会留在我身边 可我次次推开你 说那些你不爱听的话 我总在挑战你的底线 对不起 我总这样 后来每次碰到有关交情的事 总是会想起你 我心里最大的洞就是你 怎么我总是跟别人会有矛盾 总留不住重要的人啊,2022-07-19,0,,1658175624743
50,1935731269,5706872952,小乖loz,周建宁 我知道你开始不心疼我的眼泪 从此我不再对你敞开心扉 你也不再是我的靠山,2022-07-19,0,,1658175164995
51,3267559046,5706867349,烤肠加点辣,聊天dd。,2022-07-19,0,,1658173144477
52,4892505106,5706865504,小刘不是个美铝,每次听到这首歌就情不自禁哭 一放到就切 但就是要留在歌单里,2022-07-19,1,,1658172303750
53,5053077751,5706863131,念琦12,是我不坚持吗 是你心里没我你心里有我 我们怎么可能会分开,2022-07-19,9,,1658171307868
54,1546231911,5706862884,熙郭,让故事停留在这个夏季，回忆也是,2022-07-19,1,,1658171092305
55,2115504084,5706858073,帐号已注销,听歌睡觉是有心事了吗,2022-07-19,245,,1658170049145
56,3384490622,5706856559,w5yy1x,看到你的快手主页了是她的名字,2022-07-19,2,,1658169731932
57,3384490622,5706855788,w5yy1x,只是距离问题吗我搞不懂,2022-07-19,3,,1658169159834
58,3384490622,5706853895,w5yy1x,算了吧祝你开心就不祝你幸福了,2022-07-19,7,,1658168780905
59,7829816646,5706853766,iii953,往前看真的好难,2022-07-19,6,,1658168693843
60,3384490622,5706851822,w5yy1x,回不去了吗,2022-07-19,5,,1658168535533
61,3384490622,5706852760,w5yy1x,怎么不怀念呢以前天天见现在不知道什么时候才能见上一面,2022-07-19,8,,1658168497176
62,3315601618,5706851403,很讨厌早起_m,分分合合是真的喜欢 也是真的不合适我们也会有散场的那一天。祝你幸福我的泽。,2022-07-19,2,,1658168462394
63,2108412823,5706850621,小纯想睡觉-,坛 在这里你肯定找不到我了吧 我想你了 你知道吗 你现在有女朋友很幸福 可是我没了你根本不幸福 你会想我嘛 想起我们的点点滴滴会想起我嘛 我好喜欢你坛 我们在一起三个多月 你对我很好 我也后悔我之前 我很作 把你搞丢了 我知道错了 你真的太好了 我们的聊天记录我舍不得删 我们的照片我也有备份起来,2022-07-19,1,,1658168412925
64,3384490622,5706850590,w5yy1x,思念没有尽头你看不到我的思念,2022-07-19,3,,1658168390313
65,3384490622,5706851238,w5yy1x,说记得我的好也能够忘掉我迟早,2022-07-19,2,,1658168351774
66,2032041799,5706850391,世界很大开心第一YY,小乖下次记住啦吧不要在爱里说反话喔小乖 我祝你天天开心啦,2022-07-19,2,,1658168282266
67,3280452063,5706850356,弃月独行,我们之间会不会有如果,2022-07-19,3,,1658168259535
68,2032041799,5706850326,世界很大开心第一YY,小乖这是你要的结果吗,2022-07-19,2,,1658168249344
69,3280452063,5706849316,弃月独行,我这么普通，你会忘掉我很正常,2022-07-19,2,,1658168243332
70,2032041799,5706851021,世界很大开心第一YY,如果的如果呢,2022-07-19,0,,1658168236383
71,3280452063,5706850853,弃月独行,我想上清华北大,2022-07-19,1,,1658168147964
72,3280452063,5706850831,弃月独行,好想你，你会不会想起我，想早一点把你忘了，如果我们直接有如果，如果呢，你会不会也喜欢我。,2022-07-19,6,,1658168135952
73,1660620710,5706848441,但紅葉,朋友推荐，耳朵怀孕，,2022-07-19,1,,1658167895065
74,3815795088,5706845994,梓昊5,我好久没更新动态了妮妮 今天和朋友出去喝酒 好想你好想你好想你,2022-07-19,15,,1658167473864
75,1955650064,5706845867,東京雪--,思念的尽头是重逢吗我的小少爷,2022-07-19,1,,1658167398415
76,5204503343,5706845407,LzT不乖a,我太想被爱了 可是我长的不够漂亮。,2022-07-19,2,,1658167320316
77,5204503343,5706845404,LzT不乖a,我太想被爱了 可是我长的不够漂亮。,2022-07-19,2,,1658167319792
78,2096856842,5706844657,梨花诗886,被爱的人不晚睡 现在是凌晨2：01,2022-07-19,9,,1658167296243
79,3909151524,5706844283,XCHUN_,我知道我们还算不上很喜欢 想和你说说话 太越界 所以不说了,2022-07-19,4,,1658167120455
