,user.userId,commentId,user.nickname,content,timeStr,likedCount,ipLocation.location,time
482,7908418217,5700147338,阿魚a_e,我不明白为什么有的人可以说不喜欢就不喜欢,2022-07-08,19,,1657292911082
483,5208104984,5700147309,是玲不是琳_Nw2k,连天气都是阴晴不定 谁又保证身边的一切不会变,2022-07-08,3,,1657292900957
484,5145604737,5700144584,亲爱的数码恋人,他权衡利弊，那你及时止损,2022-07-08,6,,1657292721341
485,4054012200,5700143989,__早睡,今天不喜欢你了今天心情不好,2022-07-08,29,,1657292571890
486,6440805338,5700140361,LIZHENSWDWY思雨,如果说是真的爱我 那为何都说不出口,2022-07-08,5,,1657292238119
487,3873257197,5700133850,万大门,可这如死水的心越来越平静,2022-07-08,2,,1657291576188
488,6290120268,5700130331,肚子饿_wen,我真的好想你。,2022-07-08,5,,1657291413558
489,3221154984,5700121024,斩情-LING,被爱的方式五花八门 不爱的借口千篇一律.,2022-07-08,4,,1657290592369
490,3221154984,5700120022,斩情-LING,算了 就让你你留在我越来越模糊的记忆里吧.,2022-07-08,3,,1657290580451
491,3221154984,5700121850,斩情-LING,https://qa.igame.163.com/st/platform/qiyu?scope=yunyinyue163,2022-07-08,0,,1657290565695
492,3645638506,5700117871,那我呢_18,面无表情我装的 我更擅长转头掉眼泪,2022-07-08,4,,1657290297889
493,2122025742,5700115786,一定会到身边,我身高167 穿37码的鞋 没有爱的人 不挑食 不要忘了我 我叫wqp,2022-07-08,11,,1657290040002
494,3281737550,5700112557,回忆未止,在找你的话 会显的我很卑微吗,2022-07-08,3,,1657289974556
495,2067849182,5700112413,Crutiiy,动态,2022-07-08,0,,1657289936586
496,1679233510,5700101445,难遇情-7_,我是一名初二的学生  我喜欢上了一个初三的男孩子  从第一次遇见他就可以说是一见钟情了  他就这样进入了我的世界   每天都会打听他的一切   看到他真的会不由自主的笑  然后就偷偷的了解他  要到他的联系方式并且加了他  会和他聊天  到现在为止还是没勇气表白.,2022-07-08,0,,1657288963454
497,3252901860,5700093464,淋碎阴天,可能我的喜欢太极端了  他在远离我  可是他不知道 当我知道他有了喜欢的女孩子 我全身发抖   那种无力感 至今我都记得  那种没资格的询问  让我一次次崩溃  s  你肯定不知道  这是我喜欢你的第200天  你一定以为我放心了  可是我没有,2022-07-08,1,,1657288311169
498,1329770102,5700091121,maomao_mn,怎么样才能找到爱情,2022-07-08,1,,1657288048161
499,372563721,5700085179,埘戚,"我已经坚强成淡定 克制 理智 理性的人了
尽管我也想该撒娇就撒娇
想哭鼻子就哭鼻子
但现实不允许我也不允许
尽管我也想被人宠着
但现实就是深吸一口气咬牙切齿的往下走",2022-07-08,1,,1657287544478
0,3855910337,5700083528,思绪愿,又不是小说 暗恋怎么会成功,2022-07-08,5,,1657287408790
1,1831109929,5700081890,总闪躲你的爱,21世纪的玫瑰泛滥成灾 廉价的爱布满街道,2022-07-08,3,,1657287187575
2,1831109929,5700081218,总闪躲你的爱,我从没想过我们会这么快潦草收场 但如果这是你想要的结局 那我祝你满意,2022-07-08,5,,1657287169767
3,1831109929,5700081172,总闪躲你的爱,我对你掏出真心了，你把我当什么了,2022-07-08,2,,1657287157790
4,6448616092,5700079705,知爱有千难,爱我吧 求你了,2022-07-08,1,,1657287131304
5,2141397794,5700071818,抒写浪漫-L,明明已经被爱了 为什么还总是哭 他变了 变的陌生了 越来越搞不懂他了 他总是认为我在和他闹 他要实习没空陪我 我能理解 可他总是说我不理解他 我该怎么理解。我们是异地恋 很少见面 他没谈过恋爱。,2022-07-08,2,,1657286236418
6,1933756818,5700070057,冬日恋小然,可惜恋爱不是写歌再认真也成不了风格,2022-07-08,1,,1657286122548
7,3220140913,5700067646,安愔道,跟我谈恋爱吧，不想烦了,2022-07-08,3,,1657285992429
8,3282748800,5700068283,-小学生耶,我等了他1019天,2022-07-08,6,,1657285961169
9,439576108,5700051966,旺旺旺碎斌斌,有机会的话带你走进婚姻的殿堂 我是说有机会 等这个有机会的机会到来,2022-07-08,0,,1657284295056
10,1434727869,5700043534,我很认真啦,小乖总是唉声叹气 幸福会跑掉的,2022-07-08,2,,1657283534300
11,3726176063,5700039333,需要多久才能释怀,骗我 敷衍我 看见我的消息不回 聊着聊着就消失 拿我的热情开玩笑 你就那么确定我不会走,2022-07-08,1,,1657282943416
12,3725507219,5700039251,悬上忆,可是我爱你真的没有说出口。,2022-07-08,0,,1657282918853
13,1348477298,5700039005,小鬼别掉队ikz,能开心的话 当笨蛋也没关系,2022-07-08,0,,1657282832129
14,3809376903,5700029900,你总说要坦诚,为什么这么不顺利,2022-07-08,0,,1657281740556
15,4947771917,5700023067,海芋恋ovo,上次听这首歌的时候你还在身旁,2022-07-08,3,,1657281109083
16,1434727869,5700013484,我很认真啦,我不开心,2022-07-08,1,,1657280230615
17,1620840645,5700003075,记得颖的好,你站的好远 不会听见我心里的这片海,2022-07-08,2,,1657278731107
18,6408781064,5700002845,多雾的海边,宝.我虚荣心作祟.六一节看见她们有礼物.我羡慕极了.然后跟你要封手写情书.可是现在了我还没有收到.别人手都不用伸就有的东西  我要都要不来.宝.礼物我不要啦.手写情书太贵重了.留给对的人吧.,2022-07-08,2,,1657278636895
19,1801601588,5699997211,qqq-5,是你连原因都没有说 就疏远我,2022-07-08,8,,1657278044907
20,2015985345,5699989719,爱玩宝宝巴士,暗恋过他 上课偷看过我知道你一定明白我的心意 那天你跟我说一起打游戏 我问你为什么不跟我玩王者 你说 不想玩 我下了个LOL陪你玩 你说我菜 我知道你在开玩笑 我也在笑 打了一会应该是心态不好了就没说话了 我说我困了 你说晚安 那是我记得最清楚的 因为那句晚安 我很开心 后面你离我越来越远了,2022-07-08,2,,1657277494547
21,3318391171,5699990023,好烦长不高啊,结束了吗 像结束我们一起听歌一样,2022-07-08,2,,1657277281775
22,3318391171,5699984996,好烦长不高啊,什么时候回来 我很想你,2022-07-08,1,,1657276631663
23,3318391171,5699984032,好烦长不高啊,骗我的事情还少吗,2022-07-08,1,,1657276619601
24,3318391171,5699983990,好烦长不高啊,可是我嘴硬我宁愿错过也不愿意说出来,2022-07-08,2,,1657276604335
25,421787378,5699983022,SH霍建华,[奸笑],2022-07-08,0,,1657276593498
26,3318391171,5699981696,好烦长不高啊,你的承诺还可信吗,2022-07-08,1,,1657276499777
27,3318391171,5699981658,好烦长不高啊,我们是不是不合适,2022-07-08,1,,1657276484235
28,3318391171,5699980702,好烦长不高啊,还会想起我吗,2022-07-08,1,,1657276473857
29,6270054824,5699977692,一叶绾绾,总该释怀，我哭的稀里哗啦他在呲个大牙陪着别的女孩子,2022-07-08,0,,1657276107295
30,3268595698,5699975322,lxr1231_,洋 那说好的以后也是假的喽？,2022-07-08,4,,1657275658096
31,3268595698,5699974144,lxr1231_,洋 我以为我们永远都有话说,2022-07-08,3,,1657275582775
32,3268595698,5699973596,lxr1231_,可你总学风 给我带来忽冷忽热,2022-07-08,3,,1657275494186
33,3278005825,5699972462,魚恋海_ka8b,我喜欢过一个人 我们是去军训认识的 他兄弟问我要微信 我没给 然后一群男的跟着我 我在他们那些人群中看到了他 我不要脸的冲上去问他有没有V他说有 我跟他说 下课你等着我 咱俩加个微信呗 就这样子我们认识了 每次下课 他会盯着我看 当然我也会盯着他看 有一次不小心我们两个对视上了 挺尴尬的,2022-07-08,0,,1657275399505
34,3278005825,5699971501,魚恋海_ka8b,我亲过他的脸 亲过他的嘴 抱过他 吸过他吸过的烟 喝过他喝过的奶茶 听他叫我媳妇 听他叫我宝宝 宝贝 但是我们分开了 我们的故事不再继续.,2022-07-08,0,,1657275386760
35,3268595698,5699971357,lxr1231_,我的爱是单相思 是琢磨你的文字 放大你的图片,2022-07-08,3,,1657275337735
36,3268595698,5699972237,lxr1231_,心若诚 则永不分离,2022-07-08,2,,1657275323666
37,3268595698,5699973036,lxr1231_,后来想念你的时刻 只能停留在你的社交页面发着呆,2022-07-08,4,,1657275310825
38,3278005825,5699971247,魚恋海_ka8b,我喜欢过一个人 我们是去军训认识的 他兄弟问我要微信 我没给 然后一群男的跟着我 我在他们那些人群中看到了他 我不要脸的冲上去问他有没有V他说有 我跟他说 下课你等着我 咱俩加个微信呗 就这样子我们认识了 每次下课 他会盯着我看 当然我也会盯着他看 有一次不小心我们两个对视上了 挺尴尬的,2022-07-08,0,,1657275303415
39,609551327,5699970778,花野_buSI,如果他不狠心 他回头看看我 或许我和他还能走很远 分明他说过 不会有他不爱我的那一天,2022-07-08,0,,1657275147259
40,3278005825,5699969285,魚恋海_ka8b,我喜欢过一个人 我们是去军训认识的 他兄弟问我要微信 我没给 然后一群男的跟着我 我在他们那些人群中看到了他 我不要脸的冲上去问他有没有V他说有 我跟他说 下课你等着我 咱俩加个微信呗 就这样子我们认识了 每次下课 他会盯着我看 当然我也会盯着他看 有一次不小心我们两个对视上了 挺尴尬的,2022-07-08,2,,1657275002543
41,3333553667,5699969170,不开心会撸撸脸,如果说是真的爱我那为何都说不出口,2022-07-08,0,,1657274969451
42,1980310082,5699967843,-早碎早起咯-,把我灌醉吧 我把真心话讲给你听.,2022-07-08,0,,1657274842495
43,1722164141,5699966922,想和你拉手,我好想你,2022-07-08,0,,1657274649806
44,3235608289,5699960218,小唉叹,懒得去想 要么真诚要么滚,2022-07-08,2,,1657274015549
45,4894712619,5699958868,海也有故事,怎么说呢说不明白,2022-07-08,1,,1657273853327
46,5048651219,5699955526,矢心恋-y,来个男的 跟我聊。,2022-07-08,0,,1657273467658
47,5048651219,5699955415,矢心恋-y,释怀了吗？,2022-07-08,0,,1657273425887
48,3889217272,5699955125,雨天相爱,对不起 我老是对你说再见 却每次都后悔,2022-07-08,0,,1657273319189
49,7866516443,5699950463,思想禁锢者,你太固执了只记住了我的不好,2022-07-08,1,,1657273014557
50,3265673065,5699949198,破碎小轩饱,记住了 这次分开 无重逢一说,2022-07-08,21,,1657272625195
51,1956177020,5699941616,沉睡向往的梦境L,我们真的没可能了吗？可是我不想...我不甘心,2022-07-08,6,,1657271995135
52,1956177020,5699943260,沉睡向往的梦境L,"你把名字改了......为什么呢...
今天你把QQ空间设私密了...",2022-07-08,2,,1657271966702
53,1956177020,5699937911,沉睡向往的梦境L,睡前在想你睡醒后还在想你  你叫我该怎么忘  该怎么放下你呀  或许这辈子我都带着你留给我的回忆和你的影子走完这一辈子,2022-07-08,5,,1657271412087
54,4903417787,5699904538,大约在冬季_Ah5X,如果那时候没有犯贱删他微信该多好说不定现在还会像之前一样和他聊天可是如果没删我还是会像之前一样喜欢这他删了还是有一定好处的但是我现在后悔了我发现我还是离开不了他如果还有一次选择的话我死也不删,2022-07-08,0,,1657268789370
55,3987209841,5699904050,晚安土豆泥,释怀了吗？他好像没有,2022-07-08,2,,1657268432877
56,2140600742,5699845152,生气就不吃饭,或许你也想我,2022-07-08,0,,1657266530957
57,2140600742,5699845121,生气就不吃饭,今天回小学看了一眼 好像什么都变了 又好像什么都没变 ,2022-07-08,1,,1657266520744
58,1994974023,5699800886,做回梨花诗,我的w 回来吧,2022-07-08,0,,1657264764393
59,1758171336,5699775631,难读就翻篇_ss,我不会活在过去 你也不在是我的青春,2022-07-08,2,,1657264014199
60,1758171336,5699775425,难读就翻篇_ss,小乖 我试过和别人聊天 聊的很开心 自认为已经忘记你了 可每当夜深人静的时候 我会发现 我还没过去那道坎,2022-07-08,6,,1657263933369
61,1758171336,5699775371,难读就翻篇_ss,对的人站在你的未来里.,2022-07-08,2,,1657263914776
62,1758171336,5699770570,难读就翻篇_ss,他怎么认识你的 都会以同样的方式认识其他人 他对你说过什么话一模一样的也会对其他人说几百次 有什么好感动的.,2022-07-08,4,,1657263902484
63,3967070260,5699743915,爱总没有结果,厌烦我的情绪你没说我知道,2022-07-08,6,,1657261778775
64,5082715630,5699740699,小琳独自听歌,小少爷 你也有让你刻骨铭心的人吗,2022-07-08,1,,1657261638806
65,6487023776,5699717028,愚蠢的小狗_,亲爱的w 暗恋你的第四年了,2022-07-08,1,,1657258443355
66,1863961503,5699705595,俺不吃姜,如果呢，再来一次呢，听完这首歌，我就去复读,2022-07-08,1,,1657257225448
67,5137742027,5699704252,YAOXXB,如果你也喜欢我 我们就有结果,2022-07-08,1,,1657257103676
68,4941091294,5699704091,坏男人远离仪,"当然喜欢你哦,可你总让我掉眼泪。",2022-07-08,0,,1657257053009
69,1844594917,5699697610,爱就和,爱情又不是商品，哪有什么等价交换,2022-07-08,0,,1657256327038
70,3903631892,5699685992,斩情_iCzx,我好想你,2022-07-08,0,,1657255006017
71,3333310148,5699683606,82674492,听不腻的歌 留不完的言 放不下的你,2022-07-08,5,,1657254880887
72,3222999707,5699680952,秋呓海_,话说三遍淡如水 还说吗 不说了吧.,2022-07-08,1,,1657254360236
73,3222999707,5699676604,秋呓海_,原来看到别人幸福也会落泪啊.,2022-07-08,1,,1657254187006
74,3247659970,5699180800,峙卮,如果能放下所有回忆就好了,2022-07-08,1,,1657253128659
75,3282872089,5699663503,最烦大饼男,唯一一首听不腻的歌,2022-07-08,10,,1657252575006
76,7896063143,5699662542,陪着小翔,哭不动了我也堵他不喜欢我了 我只求他是最平安。,2022-07-08,3,,1657252423617
77,1953211179,5699658920,晗也念你,你不用记得我 你只要记得 那年我陪你长大 为你凌晨写小作文 每天都盼着见面 期待未来的我 只有十几岁 你记得吗,2022-07-08,6,,1657251830458
78,1877164340,5699653447,绵绵相思情,我时常自信时常自卑  时常在想什么样的人才会带着真诚来到我身边,2022-07-08,1,,1657251277019
79,5180192555,5699653147,呆妹症,沉默和睡觉是逃避一切的办法可我睡不着只能沉默,2022-07-08,4,,1657251155256
80,3816193192,5699634575,帐号已注销,他喜欢抽利群,2022-07-08,3,,1657248769706
81,1953125304,5699630257,恋怡番,记忆要怎么删,2022-07-08,1,,1657248111765
82,3860585682,5699628371,冰岛_L__ySus,不回消息很正常  大家不都只跟自己喜欢的人聊天不是吗,2022-07-08,10,,1657247893747
83,1756385452,5699628145,老坛孙菜x,好好生活 有缘份有那份机遇的话还会相遇的,2022-07-08,0,,1657247800414
84,7930807595,5699618521,万千思绪化为你,傻瓜别伤感了，你不还有我嘛,2022-07-08,1,,1657246586822
85,1498633968,5699605392,替代品_8AoO,有一个故事一年后我来讲.,2022-07-08,1,,1657244869159
86,3963194437,5699594131,凯凯-hl,本小姐要让心变得跟从前一样硬,2022-07-08,1,,1657243201539
87,2015971547,5699590461,赋予念的诗篇,想和你一起看海 也想和海一起看你,2022-07-08,2,,1657242918975
88,6270355304,5699578018,杰哥是虚哥,我最不擅长挽留  可你们个个都要走,2022-07-08,4,,1657241082461
89,3314271814,5699573335,一季樱花丶落雨殇forever,全部结束吧。,2022-07-08,4,,1657240234638
90,3919720112,5699569669,困不醒的小馨,我若是喜欢什么，肯定容不下别的，永远都会记着，一千遍，一万遍，多少年都不会变。,2022-07-08,0,,1657239739601
91,3919720112,5699571301,困不醒的小馨,总是习惯委屈自己成全他人，可不是什么好习惯。要知道，没有人会感谢你。,2022-07-08,0,,1657239729768
92,3873270560,5699563160,涵崽碎碎念ovo,如果爱只是说说 那哑巴怎么办,2022-07-08,7,,1657238121828
93,1956177020,5699560740,沉睡向往的梦境L,如果这是场意外你回不回来,2022-07-08,1,,1657237223638
94,1956177020,5699558586,沉睡向往的梦境L,如果这是场意外你会不会来？,2022-07-08,2,,1657237114540
95,1829650172,5699550256,小讽情,我总是用些幼稚的方法想引起你的注意 比如频繁的发朋友圈,2022-07-08,10,,1657233886568
96,1829650172,5699550204,小讽情,想了一晚上你 你不知道,2022-07-08,5,,1657233824231
97,1829650172,5699549353,小讽情,睡不着,2022-07-08,5,,1657233810502
98,3404050596,5699545629,单恋佳崽,2022.7.8 云 今天跟你电话 我喂了两声你没理我 我以为你睡着了 敲敲的说了句“我想你啦”然后你回了我一句 “我也想你了 笨蛋 快点睡觉 再不睡觉我生气了”哈哈哈哈哈我好开心喔我问你不是睡着了吗 你跟我说“我故意不理你的 想看看你这个笨蛋平时我睡着之后你都会说些什么”我真的好喜欢你,2022-07-08,5,,1657232251572
99,3377770801,5699546051,97ink,那你呢 希望这个7月有什么,2022-07-08,4,,1657231540847
100,1489017847,5699543677,-期待值-,不知为何 无法感受到你的不舍,2022-07-08,2,,1657230778615
101,6458035209,5699543209,小怡至上,我也想知道你心里到底有没有我 可我不是你 也猜不透你,2022-07-08,0,,1657229796145
102,1688712470,5699535382,溪溪想你了_,第一次见你的时候是昏暗的走廊，那个时候我和你兄弟谈恋爱你还给我们传达小纸条。,2022-07-08,2,,1657224616075
103,1688712470,5699533632,溪溪想你了_,我真的真的真的真的真的真的超级超级超级超级超级超级超级超级超级超级超级超级超级超级超级超级超级超级超级超级超级超级想你。,2022-07-08,1,,1657224549441
104,1688712470,5699535318,溪溪想你了_,因为搞不懂你，所以我才会选择相信星座。,2022-07-08,2,,1657224523556
105,1802751592,5699534064,降临_ve,见一面吧,2022-07-08,1,,1657224061165
106,630226045,5699534017,等wby,不会再想去恋爱了,2022-07-08,2,,1657224011507
107,451121568,5699530568,橘子乖不乖,我躺到床上发呆  思来想去  想了又想 总觉得自己应该越来越好越来越开心才好。,2022-07-08,5,,1657223068744
108,3980800667,5699530739,Allen-RjiaL,听够一万遍就释怀.,2022-07-08,8,,1657222505010
109,482472544,5699516157,别丢下我www,如果说是真的爱我 那为何都说不出口呢 Y.,2022-07-08,1,,1657218401334
110,1464857893,5699511010,抱走肉肉-,我睡不着,2022-07-08,1,,1657217225025
111,3917732914,5699509944,汤圆一米八六,嗯,2022-07-08,0,,1657217100997
112,3419506842,5699507515,哈哈价格法,如果有意义的话 等多久都不算久,2022-07-08,3,,1657216877976
113,1813418815,5699508177,7sko,分享给我你们的文案吧,2022-07-08,0,,1657216777424
114,1859082643,5699508065,两碗粥z,整整433天 都没有见面 你在那边怎么样 明天阿姨约我吃饭 我好想你 你在那边有好好吃饭吗 有后悔那天的选择吗,2022-07-08,1,,1657216715175
115,3441898601,5699507091,早结束,后来呢 记忆是唯一的见面方式,2022-07-08,7,,1657216665014
116,1408888750,5699502016,情欥,说了不再见，但还是会期待可以再遇见,2022-07-08,2,,1657215710413
117,2060766829,5699497756,7vek,心比长相好 懂比爱重要,2022-07-08,14,,1657215112647
118,7918196644,5699489030,Guan-同学,啥时候大家能在聚一聚呢.如果可以我想当面和你说对不起.,2022-07-08,0,,1657214060568
119,2117824573,5699486816,翊宸_y,据说人这一生只会真正的去爱一个人 而之后爱的人都是在寻找她的影子,2022-07-08,3,,1657213671671
120,3289486164,5699484035,黑色可达鸭,今天是7.8号，分开的两个月，说不想复合是假的，中考过去了，心里还是有你，咱俩之前吵架无论错在谁方都是我先第一次低头，然后装作若无其事，你就不能拉下脸来找我吗？没有你在的日子打游戏也没劲，干什么都没心情，瘦到了77斤，没什么了,2022-07-08,1,,1657213424042
121,1524058955,5699481884,好想好想吃汉堡,歪个楼呜呜 有姐妹愿意出7.24广州场的v区嘛 真的好想看郑润泽！！,2022-07-08,1,,1657213317617
122,1390174692,5699480054,chillo_o,没办法的迟早分开,2022-07-08,0,,1657213041241
123,1868666579,5699480753,Lonely_3C,动态,2022-07-08,1,,1657213008039
124,1450180161,5699477207,海上钢琴师1900_Zz,如果说是真的爱我  那为何都说不出口,2022-07-08,1,,1657212773850
125,3895860292,5699475949,林语惊_ez2j,暗恋的遗憾就是我知道了你的名字 听过你的声音 和你对视过 知道你的温柔 却没能大胆一点 到最后我们以遗憾收场,2022-07-08,4,,1657212688389
126,3576275316,5699476758,着迷于打直球_,没人能在感情里如水得鱼 大家都是载入感情的消费者,2022-07-08,0,,1657212637764
127,3292474494,5699472359,思念soez,高思远我爱你。,2022-07-08,0,,1657212271901
128,6308723734,5699466905,Aaaaa_-云,z   你既然不喜欢我 那为什么一次又一次的给我展现出你很喜欢我的感觉呢 我以为你只对我一个人很好 没想到你对每个人都是这样的 求求你别出现在我的生活中了我每天都是以泪洗面 这样的生活真的很难受 算我求你了.,2022-07-08,5,,1657211811845
129,6364494546,5699463712,Pan早点睡,我性格有问题 我不怪你 那就一拍两散,2022-07-08,1,,1657211535976
130,1734538730,5699463028,o爱睡觉-o,收了心却跑了路,2022-07-08,1,,1657211363476
131,1734538730,5699458721,o爱睡觉-o,怎么一转眼过了三年啊,2022-07-08,3,,1657211267049
132,5149946606,5699458622,小佩神-,你会遇到比我好的人 但不会遇见我这么勇敢的了 你开心就好啦 祝你平安幸福 无论和谁 当然和我那就最好啦,2022-07-08,5,,1657211243409
133,5017290299,5699458093,Dantimey,你到底是怎样做到的呢 以前一起说过的话你都忘记不在意了嘛 所以要一起走很远都是骗我的咯 小狗又孤零零啦,2022-07-08,3,,1657211121355
134,5017290299,5699455626,Dantimey,爱你这件事从来都不后悔我也从来不恨你我只恨你为什么骗我,2022-07-08,1,,1657211017574
135,5017290299,5699456432,Dantimey,想你了,2022-07-08,0,,1657210981632
136,5090411790,5699456973,思绪与我共鸣,爱是什么嘞 或许有一天再听到你的名字 我会笑着说不认识.,2022-07-08,3,,1657210874381
137,1606078575,5699450033,和彤彤恋爱吗,原来真的会有互相喜欢的人不能在一起 ,2022-07-08,2,,1657210413162
138,3286280506,5699448642,-霖尘-,在别人眼里我是个开心果，可是我也想在半夜的时候有个人可以听我唠叨一天发生的糟心事[呆],2022-07-08,0,,1657210341296
139,1606078575,5699441378,和彤彤恋爱吗,如果你心里那张底牌是我就好了.,2022-07-08,0,,1657209882761
140,1433187229,5699442071,maksoui,那就让我死在今天吧,2022-07-08,0,,1657209852692
141,1563225731,5699439957,摺柳a,下次如果做不到就不要告诉我了,2022-07-08,0,,1657209802210
142,6329037158,5699439228,恋婷ting-,我一直认为心腾干净了，住进来的人才舒服。,2022-07-08,0,,1657209710554
143,6329037158,5699435712,恋婷ting-,一句对不起有用的话，我的眼泪怎么算,2022-07-08,0,,1657209615011
144,6329037158,5699434589,恋婷ting-,我的小少爷，我在无数个夜晚想你.,2022-07-07,0,,1657209574787
145,3259004337,5699434809,知道我不吃辣就好,去年最喜欢的一首歌 今年也是,2022-07-07,3,,1657209410322
146,1401081424,5699430806,如ruu-,希望所有人都能被好好的爱,2022-07-07,0,,1657209111897
147,3972031647,5699425029,yu鱼遇鱼z,如果说，是真的爱我，那为何都说不出口,2022-07-07,0,,1657208657200
148,5151263343,5699419248,想写冬,好想你,2022-07-07,1,,1657208210185
149,5174224110,5699416560,uico1,仅仅一把火就能烧光我们的回忆吗,2022-07-07,0,,1657208030439
150,3331898645,5699415039,湫的凌迟,成 她被你保护的好好 可惜还是被我猜出来是谁啦。你放心 我不会对她怎么样的。你幸福就好,2022-07-07,1,,1657207736866
151,2061760597,5699414036,破碎帅宝,小乖 当你回头看的时候 我已经走了很远了,2022-07-07,3,,1657207684148
152,2042576935,5699410697,1m6的小苦瓜,释怀了,2022-07-07,1,,1657207548336
153,3254179459,5699410353,奶狗自嘲,一直爱我吧 像圆周率没有尽头,2022-07-07,0,,1657207463056
154,3290813974,5699410204,忧伤小杉,让我喘口气吧,2022-07-07,0,,1657207423500
155,2032041799,5699409482,世界很大开心第一YY,心比长相好 懂比爱重要,2022-07-07,0,,1657207359424
156,3290813974,5699409896,忧伤小杉,怎么就不理我了呢我是不是做错什么了我看着你的手机从4G变成5G网易云在线变成不在线我打了两个电话给你也没接发信息也没有接 我是不是做错什么了,2022-07-07,1,,1657207343812
157,2032041799,5699408597,世界很大开心第一YY,比起得到，我更希望不再失去。 ​​​,2022-07-07,0,,1657207333056
158,330956284,5699398505,heartbrk-,如果说是真的爱我,2022-07-07,1,,1657206472177
159,1887342864,5699398320,糕冷小青,能影响我情绪的人我都想远离,2022-07-07,0,,1657206422394
160,7916697926,5699396849,十的叁次方,z 如果说我忘不了你呢 后来遇到的人没有一个人身上有你的影子 你也许真的太特殊了吧 那段回忆让我怎么忘呢,2022-07-07,0,,1657206198797
161,1957664863,5699394651,陈炫起司,有些歌你不懂 就好像我这个人你也不愿意去了解,2022-07-07,0,,1657206144366
