,user.userId,commentId,user.nickname,content,timeStr,likedCount,ipLocation.location,time
13,3253780797,5714218990,续写ai篇章,hi 你还好吗 好记得我吗 分开四年多了 我们似乎都在枷锁里面吧 说说心里话吧  其实一开始我们见面的开始就是一个错误的开端  还记得吗 我们见面的那年炎夏傍晚 你说你真的很激动 可是我不激动 我一点感觉都没有 说实话我内心毫无波澜 我真的和你恰恰相反,2022-07-28,3,,1659000657452
14,2122911298,5714216627,有bing_1d09,听一百遍就忘掉他,2022-07-28,2,,1659000552452
15,416927240,5714217001,帐号已注销,要是有任意门就好了 那我就能在每个想念你到要掉眼泪时见到你,2022-07-28,2,,1659000439294
16,3393200915,5714207826,不想去听了,谁要五天黑胶快到期了,2022-07-28,1,,1658999454775
17,1947744514,5714203991,摆烂魚丶,从来都不知道 哭的时候 被人搂进怀里是什么感觉,2022-07-28,2,,1658999148835
18,539570045,5714201037,Oooryx_,你说喜欢我 可是怎么什么都不愿意为我做,2022-07-28,1,,1658998855658
19,3268205567,5714200908,小小_N6ni,谁又何尝不普通呢，只不过是她们的努力让自己发光闪耀看起来不普通罢了,2022-07-28,0,,1658998810907
20,3241613018,5714194561,讨昵,说一句爱，道一千声唉,2022-07-28,1,,1658998370355
21,1376535691,5714195203,恨自己不粉1,大道理都懂   可我就是走不出来.,2022-07-28,0,,1658998259455
22,3215972218,5714187444,冷世紀_,今天我们分开啦 放过你啦 我的全世界,2022-07-28,3,,1658997467041
23,3296496617,5714186398,bobobooy,y  我想你,2022-07-28,1,,1658997351963
24,2042115516,5714180428,重生之我是废话大王,小唐 你到底在想什么,2022-07-28,0,,1658996735686
25,3861626997,5714179764,烦嘴硬,y 怪我太嘴硬,2022-07-28,0,,1658996535277
26,1921831001,5714178151,爱与诚_xix,我在无数个夜晚里确定了我爱你,2022-07-28,0,,1658996437287
27,3816509846,5714169899,谩厌,爱不过一物降一物我承认我心甘情愿,2022-07-28,2,,1658995577456
28,1696684608,5714162185,笨笨狗_y,我真的很容易生气 也很容易闹脾气 对喜欢的人总是很作 有时候可能让你觉得好奇怪 对不起 辛苦你了乖乖,2022-07-28,1,,1658994739914
29,3728674140,5714162074,死在痛的世界,唉,2022-07-28,0,,1658994704358
30,7872353619,5714154795,又玻璃心了,她说无所谓,2022-07-28,4,,1658993890031
31,6438192820,5714152564,-桃绘_,我这脾气逼走了身边很多人我知道我改不了但我知道懂我的不会走能自己扛就别声张学会接受生活的每一个困难。,2022-07-28,3,,1658993802229
32,548915394,5714152334,Cunsl19,好了 不越界了,2022-07-28,3,,1658993720900
33,3229122550,5714138883,h_橘子海,唐璟轩.想好了吗.错过了就没有以后了.,2022-07-28,2,,1658992229491
34,3229122550,5714137602,h_橘子海,唐璟轩.复合好吗.不行的话我明天再来问.,2022-07-28,2,,1658992190743
35,5074928417,5714135484,立农饱饱_,A 你知道嘛 和你在一起的时候我总是哭 你能不能以后不要和别的女生搞暧昧,2022-07-28,3,,1658992032556
36,5074928417,5714135129,立农饱饱_,A 这首歌听100遍 我就忘记你 ,2022-07-28,5,,1658991915213
37,5074928417,5714134432,立农饱饱_,怎么办呢，所有人都知道我爱而不得了,2022-07-28,4,,1658991832052
38,3358710280,5714132074,回到相识那天,互相置气，时间长了，两颗心的距离只会越来越远,2022-07-28,2,,1658991594955
39,6356520249,5714127054,Zzzzzzzyyyyyyd,真诚待人很难吗那为什么不说呢,2022-07-28,2,,1658991068671
40,1800657343,5714119603,Ww今晚不熬夜_,那天我发现 本应只照着我的月亮 也照着别人 于是我心生妒忌 低头宣誓 再也不看月亮,2022-07-28,3,,1658990641051
41,3304864208,5714117671,帐号已注销,动态,2022-07-28,4,,1658990355002
42,1712462880,5714116582,你的氢氟酸,希望以后的你天天开心,2022-07-28,1,,1658990309072
43,4901888468,5714117741,优夏夏uzzzzz,你说 我们是不是缘分尽了 明明一直在等你 却怎么也遇不上了,2022-07-28,1,,1658990233024
44,5044288228,5714112653,QIUX_aqG2,走近你就像走进了痛苦离开你也远离了开心。,2022-07-28,3,,1658989890285
45,1605672244,5714104106,d0js25,我想你了,2022-07-28,1,,1658988824008
46,2003130780,5714102590,逃不过你这意外-,他选择了一个可以天天见面的女孩子，而不是我这样聊天都需要互相留言的，所以我不怪他,2022-07-28,2,,1658988689552
47,4957876211,5714093773,听_SsL,早睡过后 我晚上又会起来 想,2022-07-28,2,,1658987631466
48,5198005072,5714089591,幸岫,爱你的鸽子你放它飞它都不会飞,2022-07-28,6,,1658987410150
49,4898465086,5714091003,-泽川川川,你忘掉我了 可我一直记得你的好.,2022-07-28,7,,1658987391672
50,3296557572,5714083875,违心话少讲,我从未有一次想放弃过你 即使我偷偷哭了自己都不知道多少次了,2022-07-28,1,,1658986490448
51,3296557572,5714083863,违心话少讲,其实你说爱我的那天晚上我在想 就算万一以后有一天你真的伤害了我 那我也认了,2022-07-28,2,,1658986485663
52,3296557572,5714083848,违心话少讲,我开始模仿你说话的语气 你的脾气 你的性子 你的一切 好像那样就像你在我身边一样,2022-07-28,2,,1658986480672
53,6332255411,5714079852,小雨0_xK18,梅家凯，今天是我们分手的第9天，最近被查出来癌症了哈哈哈，我们好久都没见过了，听想你的,2022-07-28,4,,1658986141828
54,1762001478,5714079830,半顿吃五碗,我们终究无法和解 你已经不是我记忆中的人了 我怀念我的跟你没关系.,2022-07-28,3,,1658986135233
55,1762001478,5714077584,半顿吃五碗,我考虑的地方不比你少我知道我们有很多不合适可我还是选择握紧你的手可你为什么非要证明给我看我们真的走不下去.,2022-07-28,3,,1658986050938
56,3294314207,5714078244,谁是辣子鸡,原来意料之中的事 也还是会难过,2022-07-28,4,,1658985946044
57,1766756092,5714066846,是归赎,如果 你只喜欢我多好,2022-07-28,4,,1658984788404
58,7894413614,5714064182,帐号已注销,@芊芊_1117 ,2022-07-28,1,,1658984594404
59,3914379915,5714060316,1Uu-1,沉默杀死爱,2022-07-28,6,,1658984100722
60,1668133195,5713322199,jue得没意思,有音乐的地方，生活就不会荒芜.,2022-07-28,3,,1658983285166
61,3681965250,5714041266,零壹----,我无数次和你放这首歌 可你怎么就不能说爱我呢,2022-07-28,3,,1658982118504
62,3298337400,5714034452,Emerald_-,有一瞬间你是属于我的,2022-07-28,5,,1658981506118
63,3298337400,5714036288,Emerald_-,我们相见的方式是在梦里,2022-07-28,5,,1658981487514
64,4995214173,5714028505,睡个好觉吧了,你不觉得孤独 说浪漫点 你完全自由,2022-07-28,4,,1658980836475
65,5191124331,5714023523,07Tz,记得那天晚自习你头靠在我的肩膀问我你怎么了今天不开心吗那时我是真的爱,2022-07-28,3,,1658980259267
66,7964494977,5714019245,悲伤的Hkitty-,好冷 我说的是你的心,2022-07-28,3,,1658979779567
67,7964494977,5714018532,悲伤的Hkitty-,人人都想要真诚 但人人都不够真诚,2022-07-28,3,,1658979690078
68,7950280566,5714017538,呆呆xiao欢,和他在一起152t 这期间我没得到什么 相反他得到了很多 我常常在想 在一段感情里到底男方付出很多还是女方要付出多一点呢 我不清楚 我只知道这段感情里我什么都没有了  我付出的爱没有得到回应.,2022-07-28,2,,1658979633338
69,3289098816,5714016661,倩的岛,怪我吧，怪我有一身坏毛病,2022-07-28,1,,1658979610658
70,5017693437,5714016589,梦游世界_SE2U,好多话想说 好多话没说 好多话不能说,2022-07-28,3,,1658979585468
71,3289098816,5714018144,倩的岛,你像风，来了又走,2022-07-28,2,,1658979583317
72,2129083788,5714003385,-look-look-,爱不爱的烦死了，我只想睡个好觉，然后赶紧逃离现在,2022-07-28,3,,1658978117189
73,3440859550,5713999658,拼篇,时间会消磨一切的,2022-07-28,11,,1658977826207
74,2128899591,5714000372,手都没牵过,真话混着假话 我看不懂你,2022-07-28,3,,1658977799013
75,1788047779,5713997696,Lll_Xxxyyy,如果说……,2022-07-28,1,,1658977578408
76,3816509846,5713992551,谩厌,可唯独思念没有尽头,2022-07-28,6,,1658976996027
77,3816509846,5713993022,谩厌,什么时候能为我着迷,2022-07-28,6,,1658976969168
78,3816509846,5713992851,谩厌,我们还是说了违心的话,2022-07-28,5,,1658976910202
79,6368071351,5713987678,季雨情,或许只成为遗憾 才能让人念念不忘。,2022-07-28,5,,1658976511326
80,6368071351,5713988294,季雨情,对我上点心吧 别等感情散了才想着对我好。,2022-07-28,2,,1658976482784
81,1617888591,5713986567,悲伤像鲤鱼打挺,亲爱的少年我们终要说再见祝你一世所愿祝我也是,2022-07-28,3,,1658976307883
82,318796001,5713979421,yyiiiiqq,不是情也非爱 我的青春疼痛是自卑。,2022-07-28,2,,1658975545444
83,7926075555,5713980084,残希_yiGp,所以说是如果呢没有如果,2022-07-28,2,,1658975477068
84,318796001,5713979895,yyiiiiqq,海鸥别叫了 从今天起 我也是漂泊者了,2022-07-28,4,,1658975417853
85,1745999771,5713972550,言情ov,小乖 记住我吧 双子 生夏 喜秋 厌别离,2022-07-28,2,,1658974924330
86,4892504402,5713963120,亨原,如果呢…,2022-07-28,0,,1658973659686
87,6368071351,5713960550,季雨情,星座书上说我们不合 我偷偷撕掉了那一页。,2022-07-28,0,,1658973451753
88,3246727918,5713954208,pristingli,周游，我很想你，很想很想,2022-07-28,0,,1658972588999
89,3246727918,5713954165,pristingli,周游…你爸妈没有给我打电话，他们说你住院了为什么呢？,2022-07-28,0,,1658972573540
90,3246727918,5713954928,pristingli,周游，别说反话了，太冷了,2022-07-28,0,,1658972519787
91,1927148621,5713951139,悦己Camelia,程少商不知道什么是喜欢，不知道什么是爱，凌不疑不知道怎么去爱，两个不懂爱的人互相救赎，他为了她去融合别人，放下自己的身段向她证明他也只是一个普通人，一个渴望得到亲情和爱情的普通人。她为了他不惜得罪圣上，不顾一切救他，相信他，等他。他回来之后更是不顾一切与他在一起,2022-07-28,1,,1658972259719
92,6375943863,5713940468,共忻,是真的爱我吗？还是你无聊时的消遣?,2022-07-28,1,,1658970669870
93,1508919161,5713913953,雾野行,没有所以才说如果,2022-07-28,3,,1658965818385
94,2054867045,5713912452,Cik_279,或许是我太封建了 如果你和其他人聊的也很开心 就不要来找我了,2022-07-28,3,,1658965583808
95,3404050596,5713911430,单恋佳崽,记得那个时候我们去球场 你手破了 我给你贴创可贴 你远远的眼睛看着我 对我说谢谢 我们在图书馆 我对你说我不会啊啊 然后你又摸摸我的脑袋 跟我说我看看 我教你  在学校 你一直给我带牛奶饼干 陪我一起上下学 还小心翼翼的问能不能抱抱我 哈哈哈哈哈 好怀念啊,2022-07-28,3,,1658965404712
96,3404050596,5713911321,单恋佳崽,"我的彭飞云默默无闻从18.6爱我到22.3
让我拿什么不爱他",2022-07-28,3,,1658965301717
97,3404050596,5713911108,单恋佳崽,"彭飞云我们一直在一起吧
这是我们的第1160天 我很爱你",2022-07-28,2,,1658965130059
98,3404050596,5713912810,单恋佳崽,"2022.7.27 天气晴
拍了一组照片 彭飞云说好看",2022-07-28,3,,1658965050022
99,6489748134,5713909732,放弃_0910,琦，我想你了我知道你要离开了，所以我也不想多说什么祝你平安,2022-07-28,1,,1658964985183
100,3404050596,5713910675,单恋佳崽,彭飞云 还记得18年那会吗 那个时候你圆圆的眼睛对我眨巴  然后轻声的问我能不能抱抱我  好怀念那个时候 当然现在也很好  你总是会伸出手要牵我的手  去哪里都要牵  因为我会平地摔哈哈哈哈哈,2022-07-28,3,,1658964948354
101,3404050596,5713908715,单恋佳崽,彭飞云 我跟你小心翼翼说话的时候 突然想起来那个时候我只会对你一副大小姐脾气 而你从来都是对我笑 耐心的哄我 现在都变了,2022-07-28,2,,1658964811447
102,4995214173,5713906256,睡个好觉吧了,再找你的话 显得我很卑微吗,2022-07-28,2,,1658963600437
103,2054867045,5713905148,Cik_279,有时候会恍惚 我们真的有那些过去吗,2022-07-28,1,,1658963204775
104,4995214173,5713906816,睡个好觉吧了,你的名字 最短的咒,2022-07-28,2,,1658963135128
105,5151293201,5713900514,写首歌念你-,我不漂亮 但我干净 我脾气不好 但我懂得适而可止 我抽烟喝酒 但我不会一直抽 一直喝 所以别站在至高点去恶意评价别人,2022-07-28,2,,1658961223086
106,3230772592,5713898222,言的岁岁年年,陈先生的生命再也不会与我的交轨了。,2022-07-28,2,,1658958922929
107,441620377,5713893715,Gaspar_J,为什么每次都不能被坚定的选择,2022-07-28,1,,1658956994146
108,1895290729,5713893660,是李山河,如果有如果就好了,2022-07-28,3,,1658956850467
109,7899517914,5713895165,歖慧_浩,终究会错过的人为什么还要相遇呢 ,2022-07-28,2,,1658956524606
110,5094633976,5713891444,小妮宝宝宝宝,我这么有趣 不能只关心我漂不漂亮。,2022-07-28,2,,1658955047964
111,622690176,5713889708,whoarexx,当时她对我说“不要做一个苦情的人”，我假装坦然地说“不会的”，真的不会吗，高一那年我用了一整年来释怀，我以为我真的释怀了，我以为在学校里能开怀大笑就能是释怀了，可是为什么在这个高三毕业的暑假里我又梦到你了，梦里面的我们当初并没有分手，感情延续到了现在，,2022-07-28,1,,1658954289852
112,1401380656,5713889918,Noiss17_,一直觉得幸福和痛苦是共存的,2022-07-28,2,,1658953956165
113,1862839974,5713887779,昧昧me,"说记得我的好 也能够忘掉我,迟早",2022-07-28,2,,1658952740629
114,3219970858,5713886109,好困的小然,好想他 好想哭 可是他现在好幸福,2022-07-28,1,,1658952041754
115,1837366280,5713882501,倾屿娆,这两年一直很爱的歌,2022-07-28,1,,1658951197381
116,5219813817,5713881632,你有本事你也叫小呈,嗯嗯遇到个挺像你的人 但了解他之后发现他其实跟你完全不一样 哈哈哈哈哈哈我们现在是朋友关系 也只能是永远的朋友关系 我跟他经常一起听歌！对了 你最近过得怎么样 考上心仪的高中了吗 其实快放下你了 只不过 恍然看到了以前在这首歌底下的留言 突然想起记忆中逐渐模糊的你 也是 我们根本不会有结果,2022-07-28,2,,1658951105276
117,3578361320,5713882933,中国移动_bwUG,我没有妈妈，自打出生以来我就是一个错误，因为没有妈妈我被校园欺凌了三年，我忍住了我忍了三年我甚至想过要报警，可是我不敢因为我懦弱我害怕，我没有在家人面前提过那三年里我是怎么被打的我毫无还手之力，我厌恶这个社会我讨厌学校的人。,2022-07-28,1,,1658950736288
118,3809979118,5713880865,嗯_讨厌每个食言的人,情绪绷不住的每一刻都是因为你,2022-07-28,2,,1658950373777
119,1783902683,5713878623,金克丝-_,喜欢一朵花未必要把它摘下来,2022-07-28,1,,1658950167955
120,1606639818,5713878073,屿舟週,如果呢,2022-07-28,1,,1658949675088
121,1938891212,5713871981,想听你的海o,乖乖，失眠了怎么办呢,2022-07-28,2,,1658947973604
122,3368082886,5713870621,痛仰文学,歌曲一旦染上回忆就会染上某个人的名字,2022-07-28,3,,1658947873969
123,3368082886,5713871329,痛仰文学,你是我青春篇章里最勇敢又失败的一页,2022-07-28,2,,1658947762863
124,3368082886,5713870452,痛仰文学,留住你和放下你 我一样也做不到,2022-07-28,2,,1658947757005
125,3368082886,5713871253,痛仰文学,如果当初没有添加好友  是不是就没有后面的故事,2022-07-28,1,,1658947718537
126,6268384324,5713869530,天才小妙,承诺不要说了 最后只有我记得,2022-07-28,5,,1658947668085
127,6268384324,5713871134,天才小妙,想和你说好多话  你的语气堵的我哑口无言,2022-07-28,3,,1658947631755
128,3626694820,5713871052,早一步春芽不发_,如果 我不能识文断字，是否，就不会再为日记里无解的情思 掉眼泪。,2022-07-28,5,,1658947578273
129,3626694820,5713870166,早一步春芽不发_,相见 不如不见，有缘 还似无缘。,2022-07-28,3,,1658947551889
130,3626694820,5713870093,早一步春芽不发_,我又何必一遍遍续写无果的结局。,2022-07-28,5,,1658947514545
131,1430145628,5713868777,用心听我说ovo,又做梦梦见你啦乖乖 我快忘了你的样子和声音 能不能不要出现我的梦里 我突然好想你陪在我身边,2022-07-28,2,,1658947184256
132,3576578510,5713867272,苦情诗的提笔者,风水轮流转都是骗人的,2022-07-28,12,,1658947013005
133,1944758126,5713868122,昼春夜,你走的好快 不回头看看我们走过的路吗,2022-07-28,5,,1658946969947
134,1425645954,5713866207,春半島__hiK,慢慢来吧 我要爱对人,2022-07-28,5,,1658946826594
135,3576578510,5713866954,苦情诗的提笔者,我猜不透你的心 所以开始信塔罗牌和星座,2022-07-28,35,,1658946805945
136,3576578510,5713866032,苦情诗的提笔者,可是我没有好看的长相 没有会哄人的嘴 我很普通,2022-07-28,3,,1658946723755
137,4914512704,5713864810,俗娩,济 你好多鱼 我好多余。,2022-07-28,1,,1658946160855
138,1364967665,5713861556,LovePeaceL,动态 谢谢,2022-07-28,0,,1658945936878
139,3374702436,5713859921,想去海边qvq,小蒋我们真的走不远嘛？ 以前我一想到你哪天离开我了我就会忍不住哭 有时我会跟你讲 你会安慰我说永远也不会不要我 可那次你说让我不要这样搞得好像你没给够我安全感 有次你和一个男生聊天打视频虽说都是朋友可你真的不懂嘛？那天我偷偷哭了很久 我换头像改状态好让你察觉到我的异常 可是我等了整整3个,2022-07-28,8,,1658945501815
140,1817048910,5713853646,小鬼的心碎日记,那时我心比天高，扬言爱比什么都重要.,2022-07-28,4,,1658944516289
141,1963589200,5713852509,小涵开心点,如果当时…,2022-07-28,0,,1658944415310
142,2072515878,5713853328,lvyy_z,他说怕自己越陷越深，所以温柔的杀死我[多多大笑],2022-07-28,0,,1658944359598
143,3873260263,5713853282,范sir222,这是一件真事，我儿子欧包盈患上二逼症晚期希望网友们可以祝福一下他,2022-07-28,0,,1658944334488
144,1963479704,5713852296,7purp1eC,犯戒套你不要死啊[流泪][流泪],2022-07-28,1,,1658944318525
145,3397679072,5713851449,猫叫十一噜,如果重来一次我一定会好好学习以至于考不上高中,2022-07-28,1,,1658944316814
146,3282799909,5713848172,三色猫薄荷,你往前走吧如果有缘分我们自然会重逢的,2022-07-28,2,,1658943745553
147,4032696234,5713848166,iuk6,我又不幸福为什么要早睡,2022-07-28,33,,1658943743698
148,3722106370,5713848077,都需要_-,我真的不知道该怎么和你解释你对我的偏见,2022-07-28,1,,1658943700337
149,3869504128,5713846254,离别篇-L,真诚当然是必杀技 但不是杀死对方的 是杀死自己的必杀技.,2022-07-28,2,,1658943429526
150,3722878883,5713840460,困淇7,三年风雨三年情 在我身边行不行,2022-07-28,2,,1658942693096
151,1993505256,5713841010,不回信息很酷吗,6627遍了,2022-07-28,1,,1658942543957
152,7938974686,5713840775,XIEXu_,xgl我想你啦,2022-07-28,2,,1658942449005
153,1917783731,5713834309,第四季的承诺_,当悲伤大于快乐时 任何关系都要停止,2022-07-28,2,,1658941884623
154,5103243723,5713833141,love羽__,我和他全是半个青梅竹马吧我俩一起长大一起上小学一起走路回家 一起上初中 我们认识8年我喜欢他了三年多 他似乎是知道我喜欢他他们班都传开了 但是他像没有听到一样 过了一段时间我没去找他但是我没控制住自己去给他发信息 与往常一样 他没有回 记得很久很久之前我在QQ上删了他那时候脑子一热说要释怀,2022-07-28,0,,1658941800832
155,2115172979,5713830516,可乐不开心--,2022年7月28日 我该放下你了尽管我很不舍但是没办法我们走不到最后我把你的一切东西都删完了我让你也删掉留着没用可你不听说什么我删了就删了吧我很喜欢你我真的太喜欢你了但是我不适合谈恋爱而且我也觉得谈恋爱没有用我希望你开心,2022-07-28,1,,1658941588578
156,5044218925,5713832089,情结qin,没亲过他的嘴 没亲过他的脸 搂过他的腰 没有喝过他喝过的水 没抽过他抽过的烟 听过他叫我宝宝 我们没有合照  不分开到现在已经48天了 可是我们的故事还是结束了。,2022-07-28,3,,1658941505015
157,3369953772,5713829346,爱情废柴_IHeb,算了吧 我们性格不合,2022-07-28,2,,1658941272993
158,3369953772,5713827507,爱情废柴_IHeb,很久没见你了，怪想的,2022-07-28,2,,1658941261655
159,5210094628,5713827887,第七页_qwq,刚认识他的时候就喜欢这首歌，现在他走了还是喜欢这首歌。,2022-07-28,2,,1658941083723
160,5210094628,5713826432,第七页_qwq,心中的emo天花板,2022-07-28,2,,1658940991763
161,1745529581,5713825430,贡菜脑子,有缘走不散 没缘求不来,2022-07-28,4,,1658940930586
162,3369953772,5713824111,爱情废柴_IHeb,还记得嘛？这首歌一直以来都很喜欢,2022-07-28,1,,1658940802792
163,3324204216,5713821278,liu_jiaxinn,H 记得我就好,2022-07-28,1,,1658940554761
164,5144136287,5713819263,以君盛夏换我余生,很想问你，你爱过吗,2022-07-28,1,,1658940254075
165,2074773274,5713818998,温柔匿于情,我没什么愿望 只是想遇到一个可以好好爱我 可以和我分享日常生活的人 我只是想被好好爱一次而已 如果这个人是你就好了。,2022-07-28,2,,1658940180436
166,1851134258,5713816670,掌中宝_y,原来你和谁聊天都能聊那么开心,2022-07-28,4,,1658940092430
167,494593564,5713815620,Lin-52-,算了,2022-07-28,1,,1658940063046
168,6427527926,5713812810,听-杀,00:32我没睡，嗨害嗨，我不emo，我看你们emo[开心],2022-07-28,0,,1658939991984
169,4029642389,5713816023,汤颖a,想要一个男朋友,2022-07-28,0,,1658939913603
170,2087027880,5713813350,悲伤螺蛳粉-xcx,成和你在一起我真的很开心我喜欢你叫我乖乖 大聪明的样子我私心想着你只属于我一个人的但是你是自由的,2022-07-28,0,,1658939728743
171,3388189656,5713813108,sans_vThk,那为何又说不出口,2022-07-28,0,,1658939664090
172,3302810754,5713813087,昏睡小喵,晚安 随便吧,2022-07-28,0,,1658939656733
173,3302810754,5713811752,昏睡小喵,为什么要丢下我 为什么要留我一个人 为什么要离开我 你说的话你一句都不记得了吗,2022-07-28,1,,1658939528462
174,3302810754,5713809624,昏睡小喵,为什么要骗我,2022-07-28,1,,1658939501523
175,3302810754,5713810430,昏睡小喵,你个骗子,2022-07-28,2,,1658939495132
176,1752549594,5713810107,岁岁lllll,董卿写过一段话 无论我们最后生疏成什么样子 曾经对你的好都是真的 就算终有一散 也别辜负相遇 希望你不后悔认识我 也是真的快乐过 如果能回到从前 我会选择不认识你 不是我后悔 是我不能面对现在的结局,2022-07-28,2,,1658939411417
177,1459433029,5713805296,油炸波克比,所有事情不那么清晰,2022-07-28,1,,1658939009154
178,1525851280,5713803645,小圆ke,其实我不是真的释怀，而是背着所有人偷偷难过,2022-07-28,0,,1658938977894
179,1776603233,5713802841,Aeoxxx,那你呢 说的永远又是多久,2022-07-28,0,,1658938772088
180,4872416832,5713795572,-落選,我深知自己困在海里 但我却永远上不了岸,2022-07-28,0,,1658938293097
181,1958792143,5713795430,MSLOVEQ,没有下次了 我也没有勇气了。,2022-07-28,0,,1658938257753
182,1744647045,5713796093,模糊停格,如果呢,2022-07-28,0,,1658938228326
183,2125119627,5713790369,纽约看夕阳_,x  你要是记住我的好就好了  我们就不会变成现在这样了。,2022-07-28,0,,1658937842806
184,3301203063,5713785593,旧唱片-hikj,可惜我们都不勇敢 到最后谁也没能成为谁的谁.,2022-07-28,4,,1658937622203
185,3284069751,5713782629,最害怕你哭啦,我拿七分情也没换到你三分真诚.,2022-07-27,0,,1658937399813
186,5017982682,5713782878,郭瀞怡,其实我真的不想错过你 也不想看着你爱别人，可是我真的无能为力.,2022-07-27,3,,1658937286655
187,330240279,5713779195,霜遥--,什么时候能遇到一个可以互相倾诉  彼此之间没有顾虑的人呢,2022-07-27,4,,1658937036695
188,2096856842,5713777084,梨花诗886,好啦 晚安哟,2022-07-27,0,,1658936857373
189,2122025742,5713776406,一定会到身边,我委屈才会说睡了 你知道的 我从来都不会早睡,2022-07-27,1,,1658936840599
190,1534972001,5713776403,为何对我意难平,你在听什么歌 心里在想什么人,2022-07-27,0,,1658936840451
191,2096856842,5713776327,梨花诗886,佩奇 还有179天咯 之后就不等你啦 从今天开始我要早睡啦 不熬夜咯 做回自己了 偶尔朋友聚聚 按时睡觉 不用胡思乱想 不想爱 也不想我被爱.,2022-07-27,1,,1658936822565
192,1495102612,5713774167,Aka百变小豪_A9Q8,喜欢你@风格的剑 ,2022-07-27,2,,1658936634395
193,4968504288,5713766043,你的阿拆y,如果你也像我喜欢你一样喜欢我呢 可惜没如果,2022-07-27,0,,1658935984296
